{
  "version": 1,
  "provenance": {
    "kind": "synthetic",
    "generatedBy": "migration-guard",
    "createdAt": "2026-07-27T12:15:33.104Z",
    "projectId": "zboss-page",
    "projectHash": "f0d832ca4dbd8d7aff9b18925373e2509c8a72d7be1f43a2ea2dbf9eac5a1ba2",
    "sourceIdentity": {
      "revision": "a95e4cb51ceb62cc07602fe02c3cbb3e45f271ee",
      "dirty": true,
      "dirtyFingerprint": "bffb6682d768b19e32dacea82f5870cfd0acbf74b06051dbbf5da56511df2167",
      "identity": "a95e4cb51ceb62cc07602fe02c3cbb3e45f271ee+dirty:bffb6682d768"
    },
    "runtimeContractHash": "2e9ee924208febbe51d0ca8dfb92d9617420591dc67038b2b2b9dce939ddb894"
  },
  "entries": {
    "post-zboss-data-view-dynamic-engine-use-engine-use-page-page": {
      "readiness": {
        "graphComplete": true,
        "contractsComplete": true,
        "ownershipComplete": true,
        "replayPassed": true,
        "concurrencyPassed": true,
        "faultPassed": true,
        "performancePassed": true,
        "sourceOffPassed": true,
        "rollbackPassed": true,
        "evidenceCreatedAt": "2026-07-27T12:15:33.103Z",
        "maxEvidenceAgeMs": 86400000
      },
      "scenarios": {
        "branch-coverage": {
          "scenarioId": "branch-coverage",
          "origin": "synthetic-self-test",
          "status": "passed",
          "protocol": "migration-guard.runtime-observation/v1",
          "fixtureKind": "synthetic",
          "fixtureHash": "a3854d7d6cb8e3fc538495572f0a20d55b59c930657a2fc89de8bed1b3b584d9",
          "driverResultHash": "855beae8fe2b9bd5e821f9b281470530c42f9659e7e83ce62a219e501620f3b7",
          "observationHash": "24ed5898bcb66ce1ef6fe82eff5ee0348f7f2d6028cc76126a1499f0ca2a5619",
          "dimensions": {
            "http": {
              "synthetic": true,
              "note": "schema and evidence-pipeline self-test only"
            },
            "context": {
              "synthetic": true,
              "note": "schema and evidence-pipeline self-test only"
            },
            "decisions": {
              "synthetic": true,
              "note": "schema and evidence-pipeline self-test only"
            },
            "effects": {
              "synthetic": true,
              "note": "schema and evidence-pipeline self-test only"
            },
            "state": {
              "synthetic": true,
              "note": "schema and evidence-pipeline self-test only"
            },
            "events": {
              "synthetic": true,
              "note": "schema and evidence-pipeline self-test only"
            },
            "failures": {
              "synthetic": true,
              "note": "schema and evidence-pipeline self-test only"
            }
          },
          "collectors": {},
          "semantics": {},
          "findings": []
        },
        "child-form-page": {
          "scenarioId": "child-form-page",
          "origin": "synthetic-self-test",
          "status": "passed",
          "protocol": "migration-guard.runtime-observation/v1",
          "fixtureKind": "synthetic",
          "fixtureHash": "6786cb43075174302dcf9422c4dca414b26f64b195ea716bed185510d63472e3",
          "driverResultHash": "de9bdaccb9035d6ee405004a7e5ecc0a0c7bf236970acf52956254b1c94c4a9b",
          "observationHash": "24ed5898bcb66ce1ef6fe82eff5ee0348f7f2d6028cc76126a1499f0ca2a5619",
          "dimensions": {
            "http": {
              "synthetic": true,
              "note": "schema and evidence-pipeline self-test only"
            },
            "context": {
              "synthetic": true,
              "note": "schema and evidence-pipeline self-test only"
            },
            "decisions": {
              "synthetic": true,
              "note": "schema and evidence-pipeline self-test only"
            },
            "effects": {
              "synthetic": true,
              "note": "schema and evidence-pipeline self-test only"
            },
            "state": {
              "synthetic": true,
              "note": "schema and evidence-pipeline self-test only"
            },
            "events": {
              "synthetic": true,
              "note": "schema and evidence-pipeline self-test only"
            },
            "failures": {
              "synthetic": true,
              "note": "schema and evidence-pipeline self-test only"
            }
          },
          "collectors": {},
          "semantics": {},
          "findings": []
        },
        "concurrent-write": {
          "scenarioId": "concurrent-write",
          "origin": "synthetic-self-test",
          "status": "passed",
          "protocol": "migration-guard.runtime-observation/v1",
          "fixtureKind": "synthetic",
          "fixtureHash": "c081cb43ab24e115ff9a253bd2f9db28c4295209f721e5c5c4b60763b60102ec",
          "driverResultHash": "265e6e7d530da855309c22c0dab5e8c54cc16d65cafc95dc2846cbb0c49de812",
          "observationHash": "24ed5898bcb66ce1ef6fe82eff5ee0348f7f2d6028cc76126a1499f0ca2a5619",
          "dimensions": {
            "http": {
              "synthetic": true,
              "note": "schema and evidence-pipeline self-test only"
            },
            "context": {
              "synthetic": true,
              "note": "schema and evidence-pipeline self-test only"
            },
            "decisions": {
              "synthetic": true,
              "note": "schema and evidence-pipeline self-test only"
            },
            "effects": {
              "synthetic": true,
              "note": "schema and evidence-pipeline self-test only"
            },
            "state": {
              "synthetic": true,
              "note": "schema and evidence-pipeline self-test only"
            },
            "events": {
              "synthetic": true,
              "note": "schema and evidence-pipeline self-test only"
            },
            "failures": {
              "synthetic": true,
              "note": "schema and evidence-pipeline self-test only"
            }
          },
          "collectors": {},
          "semantics": {},
          "findings": []
        },
        "context-isolation": {
          "scenarioId": "context-isolation",
          "origin": "synthetic-self-test",
          "status": "passed",
          "protocol": "migration-guard.runtime-observation/v1",
          "fixtureKind": "synthetic",
          "fixtureHash": "f94d7a43e81e94057173502a2afc3797b32bf95a9219259e699cbc3ca80a5602",
          "driverResultHash": "c34c40f76132b585270c3d93b802535f391adecfb3cb6a01053f3ceb62e41c9f",
          "observationHash": "24ed5898bcb66ce1ef6fe82eff5ee0348f7f2d6028cc76126a1499f0ca2a5619",
          "dimensions": {
            "http": {
              "synthetic": true,
              "note": "schema and evidence-pipeline self-test only"
            },
            "context": {
              "synthetic": true,
              "note": "schema and evidence-pipeline self-test only"
            },
            "decisions": {
              "synthetic": true,
              "note": "schema and evidence-pipeline self-test only"
            },
            "effects": {
              "synthetic": true,
              "note": "schema and evidence-pipeline self-test only"
            },
            "state": {
              "synthetic": true,
              "note": "schema and evidence-pipeline self-test only"
            },
            "events": {
              "synthetic": true,
              "note": "schema and evidence-pipeline self-test only"
            },
            "failures": {
              "synthetic": true,
              "note": "schema and evidence-pipeline self-test only"
            }
          },
          "collectors": {},
          "semantics": {},
          "findings": []
        },
        "dependency-failure": {
          "scenarioId": "dependency-failure",
          "origin": "synthetic-self-test",
          "status": "passed",
          "protocol": "migration-guard.runtime-observation/v1",
          "fixtureKind": "synthetic",
          "fixtureHash": "28a26207f0c55ea7895397286beb59c56dbd1f876b0bd6b2270a7cebed351d18",
          "driverResultHash": "a507ee0fb976154259f2f8581afec54b02709a6aa8d07002d8b8f743c0a96528",
          "observationHash": "24ed5898bcb66ce1ef6fe82eff5ee0348f7f2d6028cc76126a1499f0ca2a5619",
          "dimensions": {
            "http": {
              "synthetic": true,
              "note": "schema and evidence-pipeline self-test only"
            },
            "context": {
              "synthetic": true,
              "note": "schema and evidence-pipeline self-test only"
            },
            "decisions": {
              "synthetic": true,
              "note": "schema and evidence-pipeline self-test only"
            },
            "effects": {
              "synthetic": true,
              "note": "schema and evidence-pipeline self-test only"
            },
            "state": {
              "synthetic": true,
              "note": "schema and evidence-pipeline self-test only"
            },
            "events": {
              "synthetic": true,
              "note": "schema and evidence-pipeline self-test only"
            },
            "failures": {
              "synthetic": true,
              "note": "schema and evidence-pipeline self-test only"
            }
          },
          "collectors": {},
          "semantics": {},
          "findings": []
        },
        "entrypoint-parity": {
          "scenarioId": "entrypoint-parity",
          "origin": "synthetic-self-test",
          "status": "passed",
          "protocol": "migration-guard.runtime-observation/v1",
          "fixtureKind": "synthetic",
          "fixtureHash": "c559c8ccd8c74788fb3a980e4508bdc4aee59ac5f540efe7094b773750db3704",
          "driverResultHash": "a1e47646c3024a42fdc4d15a81bd132e48a3a85a734eebff2715ba2b3fa9931d",
          "observationHash": "24ed5898bcb66ce1ef6fe82eff5ee0348f7f2d6028cc76126a1499f0ca2a5619",
          "dimensions": {